{
  "schema_version": "1.0.0",
  "rules_version": "1.1.0",
  "artist": "gue",
  "artist_sound": "Rap classico: voce baritonale, asciutta e autorevole, carattere analogico, niente effetti vistosi.",
  "production_notes": [
    {
      "id": "tuning",
      "text": "Niente autotune. La voce è parlata-rappata: l'intonazione non è il punto."
    },
    {
      "id": "doubles",
      "text": "Doppia solo le rime finali, centrata, a −8 dB. Nessun allargamento."
    },
    {
      "id": "adlib",
      "text": "Ad-lib asciutti e centrati, stesso trattamento della main ma 6 dB sotto."
    },
    {
      "id": "extra",
      "text": "Il carattere sta nella saturazione a valvola e nel corpo sui 180 Hz, non nell'aria."
    }
  ],
  "generated_by": "chain_compiler.py",
  "prompt": "gue pequeno",
  "intent": {
    "schema_version": "1.0.0",
    "prompt": "gue pequeno",
    "language_hint": "unknown",
    "artist": "gue",
    "artist_sound": "Rap classico: voce baritonale, asciutta e autorevole, carattere analogico, niente effetti vistosi.",
    "forced_sends": {
      "reverb": "rev_room",
      "delay": "dly_slap",
      "fx": "fx_none"
    },
    "production_notes": {
      "tuning": "Niente autotune. La voce è parlata-rappata: l'intonazione non è il punto.",
      "doubles": "Doppia solo le rime finali, centrata, a −8 dB. Nessun allargamento.",
      "adlib": "Ad-lib asciutti e centrati, stesso trattamento della main ma 6 dB sotto.",
      "extra": "Il carattere sta nella saturazione a valvola e nel corpo sui 180 Hz, non nell'aria."
    },
    "genre": "rap",
    "axes": {
      "brightness": 0.1,
      "weight": 0.3,
      "aggression": 0.25,
      "density": 0.85,
      "character": 0.55,
      "intimacy": 0.0,
      "cleanliness": 0.8,
      "vintage": 0.35,
      "sibilance_control": 0.45
    },
    "pitch_class": "low",
    "delivery": "rapped",
    "loudness_target_lufs": -10.0,
    "matched_terms": [
      {
        "term": "gue pequeno",
        "kind": "artist",
        "applied": {
          "weight": 0.3,
          "aggression": 0.25,
          "density": 0.5,
          "character": 0.4,
          "vintage": 0.35,
          "brightness": 0.1,
          "cleanliness": 0.35
        }
      }
    ],
    "unknown_terms": []
  },
  "source_profile": {
    "id": "untreated_room_focusrite_scarlett",
    "room": {
      "treated": false,
      "size": "small",
      "noise_floor_dbfs": -50,
      "modes_hz": [
        92,
        184,
        246
      ],
      "boxy_band_hz": [
        150,
        400
      ],
      "flutter_band_hz": [
        1000,
        4000
      ]
    },
    "mic": {
      "brand": "focusrite",
      "type": "condenser",
      "pattern": "cardioid",
      "distance_cm": 10,
      "proximity_boost_db": 5,
      "sibilance_center_hz": 7000,
      "presence_peak": 1
    },
    "interface": {
      "brand": "focusrite",
      "model": "scarlett_2i2",
      "inputs": 2,
      "preamp_character": "clean",
      "target_peak_dbfs": -12,
      "assumed_peak_dbfs": -6
    },
    "io": {
      "stereo_is_dual_mono": true
    }
  },
  "io": {
    "stereo_is_dual_mono": true,
    "declared_latency_ms": 0.0
  },
  "modules": [
    {
      "id": "trim",
      "label": "Input Trim / Polarity",
      "enabled": true,
      "why": "Il gain della Scarlett viene quasi sempre impostato a occhio: porto il segnale al livello di lavoro prima che qualunque soglia in dB abbia senso.",
      "params": {
        "inTrim": {
          "value": -6.0,
          "why": "porta i picchi stimati dal profilo (-6 dBFS) al target di lavoro (-12 dBFS)",
          "unit": "dB"
        },
        "polarity": {
          "value": false,
          "why": "nessun secondo microfono da allineare: la polarità resta dritta"
        }
      }
    },
    {
      "id": "gate",
      "label": "Gate (key-filtered)",
      "enabled": true,
      "why": "Stanza non trattata: il noise floor sta a -50 dBFS e tutto quello che viene dopo lo amplificherebbe. Il detector è filtrato sulla banda di voce, così ronzii e ventole non lo aprono.",
      "params": {
        "gateThresh": {
          "value": -36.0,
          "why": "6 dB sopra il noise floor stimato, più 0.8 di severità richiesta",
          "unit": "dB"
        },
        "gateRange": {
          "value": 18.8,
          "why": "attenuazione parziale: chiudere del tutto si sente più del rumore",
          "unit": "dB"
        },
        "gateAtk": {
          "value": 1.05,
          "why": "il gate parte chiuso, quindi questo tempo entra due volte: e' la costante del detector E la rampa con cui il guadagno risale dal fondo del range fino a zero. Misurato sul DSP, la prima parola di una take esce piena dopo circa tre volte questo valore: a 2 ms perdeva 4,9 dB sui primi 10 ms con la sorgente 12 dB sotto il livello dichiarato, a 1,2 ne perde 3",
          "unit": "ms"
        },
        "gateRel": {
          "value": 145,
          "why": "rilascio lungo per non troncare le code di parola",
          "unit": "ms"
        },
        "gateKeyLo": {
          "value": 102,
          "why": "il detector ignora sotto la fondamentale: rumore di traffico e ronzii non aprono il gate",
          "unit": "Hz"
        },
        "gateKeyHi": {
          "value": 3400,
          "why": "il detector ignora sopra la banda di intelligibilità: ventole e fruscio non aprono il gate",
          "unit": "Hz"
        }
      }
    },
    {
      "id": "hpf",
      "label": "High-Pass Filter",
      "enabled": true,
      "why": "Ripresa ravvicinata su cardioide: effetto prossimità (+5 dB) e plosive vanno tolti PRIMA dei detector dinamici.",
      "params": {
        "hpfFreq": {
          "value": 80,
          "why": "compensa la prossimità sul registro low, alzato/abbassato secondo il corpo richiesto",
          "unit": "Hz"
        },
        "hpfSlope": {
          "value": 24,
          "why": "pendenza ripida: senza filtro anti-pop le plosive sono transienti di decine di dB",
          "unit": "dB/oct"
        }
      }
    },
    {
      "id": "room",
      "label": "Room Tamer (notch dinamici)",
      "enabled": true,
      "why": "I modi della stanza si eccitano solo su certe note: tre notch stretti che agiscono SOLO sopra soglia, per non togliere corpo a tutto il resto.",
      "params": {
        "room1Freq": {
          "value": 92,
          "why": "modo assiale stimato della stanza",
          "unit": "Hz"
        },
        "room1Q": {
          "value": 6.0,
          "why": "stretto: correzione, non gusto",
          "unit": "Q"
        },
        "room1Depth": {
          "value": -5.2,
          "why": "attenuazione massima quando la risonanza supera la soglia",
          "unit": "dB"
        },
        "room2Freq": {
          "value": 184,
          "why": "secondo modo / boxiness bassa",
          "unit": "Hz"
        },
        "room2Q": {
          "value": 5.0,
          "why": "stretto",
          "unit": "Q"
        },
        "room2Depth": {
          "value": -5.2,
          "why": "meno profondo se è stato chiesto corpo",
          "unit": "dB"
        },
        "room3Freq": {
          "value": 246,
          "why": "terzo modo / scatola",
          "unit": "Hz"
        },
        "room3Q": {
          "value": 5.0,
          "why": "stretto",
          "unit": "Q"
        },
        "room3Depth": {
          "value": -4.4,
          "why": "attenuazione dinamica sulla scatola",
          "unit": "dB"
        },
        "roomThresh": {
          "value": -34.8,
          "why": "soglia riferita al livello a cui un modo di stanza arriva davvero al detector (12 dB sotto il picco di lavoro), non un numero assoluto in dBFS: sotto di lei i notch stanno fermi e la voce resta intera, sopra scavano quanto la risonanza eccede",
          "unit": "dB"
        }
      }
    },
    {
      "id": "eqSub",
      "label": "EQ sottrattiva",
      "enabled": true,
      "why": "Prima togli, poi aggiungi: ogni dB tolto qui è headroom per i due compressori.",
      "params": {
        "sub1Freq": {
          "value": 204,
          "why": "centro della boxiness della stanza (150–400 Hz)",
          "unit": "Hz"
        },
        "sub1Q": {
          "value": 2.0,
          "why": "banda media: è fango, non una risonanza singola",
          "unit": "Q"
        },
        "sub1Gain": {
          "value": -3.3,
          "why": "toglie fango, ma restituisce corpo se il testo lo ha chiesto",
          "unit": "dB"
        },
        "sub2Freq": {
          "value": 850,
          "why": "banda nasale del registro low",
          "unit": "Hz"
        },
        "sub2Q": {
          "value": 3.0,
          "why": "stretto: la nasalità è localizzata",
          "unit": "Q"
        },
        "sub2Gain": {
          "value": -3.0,
          "why": "toglie il naso senza spegnere l'intelligibilità",
          "unit": "dB"
        },
        "sub3Freq": {
          "value": 2380,
          "why": "banda del flutter echo della stanza (1000–4000 Hz)",
          "unit": "Hz"
        },
        "sub3Q": {
          "value": 2.5,
          "why": "medio",
          "unit": "Q"
        },
        "sub3Gain": {
          "value": -2.0,
          "why": "asprezza della stanza, più quella tolta su richiesta esplicita",
          "unit": "dB"
        }
      }
    },
    {
      "id": "ds1",
      "label": "De-esser 1 (pre-compressione)",
      "enabled": true,
      "why": "Protegge il detector dei compressori: senza, ogni 's' innesca una riduzione che abbassa la parola intera.",
      "params": {
        "ds1Freq": {
          "value": 5652,
          "why": "centro sibilanza stimato del microfono sul registro low",
          "unit": "Hz"
        },
        "ds1Thresh": {
          "value": -26.7,
          "why": "riferita al livello di lavoro: la banda alta di una 's' arriva a -22.0 dBFS, la soglia sta sotto di quanto serve per togliere qualche dB alle esse e niente al resto",
          "unit": "dB"
        },